Composite Ids,Composite,Number of occurrence
[4],"[Change Return Type, Rename Method, Rename Method, Rename Method, Change Variable Type, Rename Method, Rename Method, Extract Method, Rename Method, Rename Method, Rename Method, Rename Method, Extract Method]",1
[9],"[Rename Method, Change Variable Type, Rename Parameter, Extract Method, Extract Method, Extract Attribute, Change Return Type]",1
[0],"[Extract Method, Extract Method, Extract Method, Extract Method, Extract Method, Extract Method, Extract Method, Extract Method, Rename Parameter, Extract Method, Change Parameter Type, Change Parameter Type, Extract Method, Extract Method, Extract Method, Extract Variable, Extract Method, Extract Method, Extract Method, Rename Parameter, Extract Method, Change Return Type, Extract Method, Extract Method, Extract Method, Extract Method, Extract Method, Extract Method, Extract Method, Extract Method, Extract Method, Rename Parameter, Change Parameter Type, Extract Method, Extract Variable, Extract Method, Extract Method, Extract Variable, Rename Method, Rename Parameter, Rename Parameter, Extract Method, Extract Method, Extract Method, Extract Method, Extract Method, Extract Method, Extract Method, Extract Method, Extract Method, Extract Method, Extract Method, Extract Method, Change Parameter Type, Extract Method, Change Parameter Type, Extract Method, Extract Method, Extract Method, Extract Method, Change Return Type, Change Parameter Type, Extract Method, Change Parameter Type, Rename Parameter, Change Parameter Type, Extract Method, Change Parameter Type, Change Parameter Type, Extract Method, Extract Method, Extract Method, Extract Method, Extract Method, Rename Parameter, Rename Parameter, Change Parameter Type, Rename Parameter, Extract Method, Extract Method, Rename Parameter, Change Parameter Type, Extract Variable, Extract Method, Change Return Type, Extract Method, Extract Method, Extract Method, Extract Method, Extract Method, Extract Class, Extract Method, Extract Method, Extract Method, Extract Method, Extract Method, Extract Method, Extract Method, Extract Method, Extract Method, Extract Method, Rename Parameter, Extract Method, Extract Method, Rename Parameter, Extract Method, Rename Parameter, Extract Method, Extract Method, Rename Attribute, Extract Method, Extract Method, Change Parameter Type, Extract Method, Extract Method, Extract Method]",1
[6],"[Move Method, Move Method, Rename Class]",1
[5],"[Rename Variable, Rename Variable, Extract Method, Rename Parameter, Rename Variable, Extract Method, Change Variable Type, Change Parameter Type, Change Variable Type, Change Return Type, Change Variable Type]",1
"[2, 7]","[Extract Method, Extract Method]",2
[3],"[Change Parameter Type, Change Return Type, Change Attribute Type, Change Return Type, Change Return Type, Rename Method, Extract Class, Move Method, Extract Variable, Move Method, Change Return Type, Extract Class, Change Return Type, Move Attribute, Change Return Type, Move Method, Rename Attribute]",1
[8],"[Rename Variable, Rename Method, Rename Variable, Change Parameter Type, Rename Variable, Inline Variable, Rename Variable, Extract Variable, Change Parameter Type, Parameterize Variable, Change Parameter Type, Merge Variable, Change Parameter Type, Change Variable Type, Rename Method, Change Parameter Type, Change Parameter Type, Extract Method, Change Parameter Type, Extract Variable, Extract Method, Change Return Type, Parameterize Variable, Extract Method, Change Parameter Type, Rename Variable, Extract Method, Extract Method, Change Parameter Type, Rename Parameter, Change Parameter Type, Change Variable Type, Rename Parameter, Change Parameter Type, Rename Variable, Extract Method, Rename Variable, Change Return Type, Change Parameter Type, Extract Method, Rename Variable, Change Variable Type, Extract Method, Change Parameter Type, Rename Variable, Rename Variable, Change Parameter Type, Change Parameter Type, Extract Method, Rename Parameter, Extract Method, Change Parameter Type, Extract Variable, Rename Variable, Extract Variable, Change Parameter Type, Rename Variable, Rename Variable, Extract Method]",1
[1],"[Rename Parameter, Extract Method, Extract Method, Rename Parameter, Rename Parameter, Rename Parameter, Rename Attribute, Rename Parameter, Rename Parameter, Extract Method, Rename Parameter, Rename Parameter, Rename Parameter]",1
